id,title,category,priority,duration_minutes,details,frequency,facilitator_role,resource_pool,location,remote_allowed,equipment_required,prep_required,backup_activity_ids,skip_adjustment,metrics,preferred_time_windows
activity_066,Medication Check - Morning Routine,Medication consumption,93,20,Review remaining medication supply and place a refill request before the final week of stock.,"{""times"": 1, ""period"": ""month""}",health_coach,allied_health,home,True,[],"[""Pharmacy details available""]","[""activity_073"", ""activity_068""]",Flag for clinician review if skipped; do not double dose without instructions.,"[""refill_requested"", ""med_list_updated""]","[""midday"", ""evening""]"
activity_109,Primary Care Review - Progress Review,Consultation,91,45,"Review symptoms, medication adherence, and recent health trends with the physician.","{""times"": 1, ""period"": ""month""}",primary_care_physician,specialist,clinic,True,[],"[""Prepare question list"", ""Upload recent metrics summary""]","[""activity_104"", ""activity_110""]",Rebook the next available provider slot and send the latest metrics summary ahead of time.,"[""questions_answered"", ""weight""]","[""morning"", ""afternoon""]"
activity_095,Soft Tissue Session - Stress Reset,Therapy,77,60,Complete targeted recovery therapy for the current mobility restriction or pain point.,"{""times"": 2, ""period"": ""month""}",physiotherapist,allied_health,clinic,False,[],"[""Pain notes updated before appointment""]","[""activity_086"", ""activity_091""]",Reschedule within the same week if symptoms are stable; otherwise mark for manual review.,"[""range_of_motion_change"", ""pain_score_post"", ""pain_score_pre""]","[""morning"", ""afternoon""]"
activity_007,Posterior Chain Session - Joint Care,Fitness routine / exercise,76,75,Complete compound lifts with controlled tempo and moderate load progression.,"{""times"": 2, ""period"": ""week""}",strength_coach,allied_health,gym,True,"[""dumbbell_set""]","[""Complete activation drills"", ""Prepare workout log""]","[""activity_014"", ""activity_033""]",Move to the next free slot within 48 hours and lower intensity by one step.,"[""load_used"", ""sets_completed"", ""session_rpe""]","[""morning"", ""evening""]"
activity_051,Post-Workout Smoothie - Protein Rebuild,Food consumption,72,15,Blend protein and hydration-supportive ingredients after higher-load training.,"{""times"": 2, ""period"": ""week""}",self_guided,self,home,False,"[""blender_station""]","[""Frozen ingredients portioned""]","[""activity_056"", ""activity_038""]",Replace with the closest balanced meal option and record deviation in the nutrition log.,"[""protein_grams"", ""recovery_score_next_day"", ""hydration_ml""]","[""morning"", ""evening""]"
